{
 "schema_version": 1,
 "id": "marketing",
 "name": "Marketing pages",
 "when": "Landing, pricing and feature pages: read once, persuade, one call to action.",
 "picks": [
  {
   "viewpoint": "usability.fitts-target-size-and-distance",
   "note": "Same rule, also stated as: usability.hicks-fewer-choices-when-time-matters (Jon Yablonski (Laws of UX)); usability.von-restorff-one-emphasis (GOV.UK Design System); craft.growth-design-psychology-principles (Growth.Design (Dan Benoni, Louis-Xavier Lavallée)); modern.no-deceptive-patterns (Harry Brignull)."
  },
  {
   "viewpoint": "usability.speak-the-users-language",
   "note": "Same rule, also stated as: writing.plain-language-reading-level (Shopify Polaris)."
  },
  {
   "viewpoint": "usability.signifiers-make-clickable-look-clickable",
   "note": "Same rule, also stated as: modern.signifiers-survive-flatness (Kate Moran (NN/G)); modern.no-dead-zones-and-honest-clickability (Rauno Freiberg)."
  },
  {
   "viewpoint": "usability.omit-needless-words",
   "note": "Same rule, also stated as: writing.sentence-case-ui-text (IBM Carbon Design System)."
  },
  {
   "viewpoint": "usability.minimalist-no-competing-information",
   "note": "Same rule, also stated as: forms.ask-only-what-you-need (GOV.UK Design System)."
  },
  {
   "viewpoint": "usability.mindless-clicks-not-fewer-clicks",
   "note": "Same rule, also stated as: writing.links-describe-their-destination (Mailchimp)."
  },
  {
   "viewpoint": "usability.banner-blindness-dont-style-content-like-ads",
   "note": "Same rule, also stated as: modern.honour-prefers-reduced-motion (Emil Kowalski); feedback.moving-content-can-be-paused (W3C Accessibility Guidelines Working Group)."
  },
  {
   "viewpoint": "usability.visual-hierarchy-for-scanning",
   "note": "Same rule, also stated as: craft.hierarchy-is-everything-squint-test (Erik D. Kennedy)."
  },
  {
   "viewpoint": "usability.no-false-affordances"
  },
  {
   "viewpoint": "usability.follow-conventions",
   "note": "Same rule, also stated as: modern.boring-and-familiar-beats-novel (Scott Berkun)."
  },
  {
   "viewpoint": "usability.aesthetic-usability-effect-bias"
  },
  {
   "viewpoint": "usability.natural-mapping-and-proximity"
  },
  {
   "viewpoint": "usability.start-with-user-needs-design-with-data"
  },
  {
   "viewpoint": "craft.fewer-borders",
   "note": "Same rule, also stated as: canon.gestalt-common-region (Aurora Harley, NN/g); canon.rams-as-little-design-as-possible (Dieter Rams); canon.vignelli-white-space-is-the-silence (Massimo Vignelli); modern.fewer-borders-more-space (Adam Wathan & Steve Schoger); canon.tufte-one-plus-one-equals-three (Edward Tufte); craft.separation-order-space-then-lines-then-boxes (Adam Wathan & Steve Schoger; Erik D. Kennedy)."
  },
  {
   "viewpoint": "craft.spacing-and-sizing-system",
   "note": "Same rule, also stated as: canon.rams-thorough-to-the-last-detail (Dieter Rams); modern.radii-are-few-and-concentric (Vercel Labs); modern.quality-is-a-choice-spec-is-the-floor (Karri Saarinen); modern.spacing-comes-from-a-scale (Stan Kirilov)."
  },
  {
   "viewpoint": "craft.wcag-contrast-and-dont-rely-on-colour-alone",
   "note": "Same rule, also stated as: modern.contrast-and-not-colour-alone (Apple); color.never-the-only-signal (W3C Accessibility Guidelines Working Group); navigation.you-are-here (U.S. Web Design System (USWDS))."
  },
  {
   "viewpoint": "craft.de-emphasize-to-emphasize-up-pop-down-pop",
   "note": "Same rule, also stated as: canon.tufte-smallest-effective-difference (Edward Tufte)."
  },
  {
   "viewpoint": "craft.tap-targets-and-control-height",
   "note": "Same rule, also stated as: modern.hit-targets-meet-platform-minimums (Apple)."
  },
  {
   "viewpoint": "craft.start-with-too-much-whitespace"
  },
  {
   "viewpoint": "craft.type-scale-few-font-sizes",
   "note": "Same rule, also stated as: canon.bringhurst-compose-with-a-scale (Robert Bringhurst)."
  },
  {
   "viewpoint": "craft.button-hierarchy-one-primary"
  },
  {
   "viewpoint": "craft.text-on-images-needs-consistent-contrast",
   "note": "Same rule, also stated as: modern.glass-and-blur-earn-their-place (Megan Brown (NN/G))."
  },
  {
   "viewpoint": "craft.greys-dont-have-to-be-grey-never-use-black"
  },
  {
   "viewpoint": "craft.line-height-tightens-as-text-grows"
  },
  {
   "viewpoint": "canon.vignelli-few-typefaces",
   "note": "Same rule, also stated as: modern.readable-type-sizes-and-weights (Rauno Freiberg)."
  },
  {
   "viewpoint": "canon.bringhurst-leading-is-a-rhythmic-unit"
  },
  {
   "viewpoint": "canon.butterick-line-spacing-120-145"
  },
  {
   "viewpoint": "canon.gestalt-closure"
  },
  {
   "viewpoint": "modern.no-junk-drawer-menus-or-unlabeled-icons",
   "note": "Same rule, also stated as: writing.buttons-name-the-action (IBM Carbon Design System); navigation.primary-nav-visible-on-wide-screens (GitHub Primer); usability.dont-make-me-think (Steve Krug); navigation.top-level-is-sections-not-a-site-map (GOV.UK Design System)."
  },
  {
   "viewpoint": "modern.interactions-feel-immediate-under-200ms",
   "note": "Same rule, also stated as: modern.motion-values-proportional-to-trigger (Rauno Freiberg); feedback.motion-duration-scales-with-size (IBM Carbon Design System)."
  },
  {
   "viewpoint": "modern.animate-only-transform-and-opacity"
  },
  {
   "viewpoint": "modern.motion-has-an-origin"
  },
  {
   "viewpoint": "modern.mobile-inputs-do-not-zoom-or-trap"
  },
  {
   "viewpoint": "modern.focus-is-visible-and-unobscured"
  },
  {
   "viewpoint": "modern.numbers-and-text-do-not-shift-layout"
  },
  {
   "viewpoint": "modern.shadows-share-one-light-source"
  },
  {
   "viewpoint": "modern.defaults-are-decisions-you-inherited"
  },
  {
   "viewpoint": "color.from-tokens-not-hex"
  },
  {
   "viewpoint": "color.one-action-colour-apart-from-status"
  },
  {
   "viewpoint": "color.focus-ring-contrasts-with-its-surroundings"
  },
  {
   "viewpoint": "color.few-families-in-proportion"
  },
  {
   "viewpoint": "data-display.no-tables-for-layout",
   "note": "Same rule, also stated as: modern.cards-are-a-choice-not-a-default (Stan Kirilov)."
  },
  {
   "viewpoint": "forms.autocomplete-names-the-purpose"
  },
  {
   "viewpoint": "navigation.skip-link-is-the-first-tab-stop"
  },
  {
   "viewpoint": "navigation.same-navigation-on-every-page"
  }
 ]
}
