{
 "schema_version": 1,
 "id": "workspace",
 "name": "Workspace and admin",
 "when": "Admin, CRUD, tables, settings and B2B tools: repeated work where speed and consistency matter.",
 "picks": [
  {
   "viewpoint": "usability.visibility-of-system-status",
   "note": "Same rule, also stated as: modern.feedback-is-local-and-optimistic (Rauno Freiberg); modern.density-is-value-per-time-and-space (Matthew Ström-Awn); writing.success-names-what-happened (Shopify Polaris); data-display.loading-skeleton-holds-the-layout (GitHub Primer); forms.do-not-disable-the-submit-button (GitHub Primer)."
  },
  {
   "viewpoint": "usability.speak-the-users-language",
   "note": "Same rule, also stated as: writing.errors-say-what-and-how-to-fix (GOV.UK Design System (Government Digital Service)); writing.plain-language-reading-level (Shopify Polaris); forms.error-message-says-how-to-fix (GOV.UK Design System); modern.quality-is-a-choice-spec-is-the-floor (Karri Saarinen)."
  },
  {
   "viewpoint": "usability.feedback-within-a-second",
   "note": "Same rule, also stated as: modern.interactions-feel-immediate-under-200ms (Rauno Freiberg)."
  },
  {
   "viewpoint": "usability.signifiers-make-clickable-look-clickable",
   "note": "Same rule, also stated as: modern.signifiers-survive-flatness (Kate Moran (NN/G)); modern.no-dead-zones-and-honest-clickability (Rauno Freiberg)."
  },
  {
   "viewpoint": "usability.omit-needless-words",
   "note": "Same rule, also stated as: writing.sentence-case-ui-text (IBM Carbon Design System)."
  },
  {
   "viewpoint": "usability.fitts-target-size-and-distance",
   "note": "Same rule, also stated as: craft.tap-targets-and-control-height (Erik D. Kennedy); modern.hit-targets-meet-platform-minimums (Apple)."
  },
  {
   "viewpoint": "usability.von-restorff-one-emphasis",
   "note": "Same rule, also stated as: craft.button-hierarchy-one-primary (Steve Schoger); writing.destructive-actions-name-the-consequence (IBM Carbon Design System)."
  },
  {
   "viewpoint": "usability.natural-mapping-and-proximity",
   "note": "Same rule, also stated as: canon.gestalt-proximity (Aurora Harley, NN/g)."
  },
  {
   "viewpoint": "usability.follow-conventions",
   "note": "Same rule, also stated as: craft.anything-but-dropdowns (Erik D. Kennedy); modern.boring-and-familiar-beats-novel (Scott Berkun)."
  },
  {
   "viewpoint": "usability.help-in-context",
   "note": "Same rule, also stated as: usability.placeholders-are-not-labels (Katie Sherwin, NN/g); forms.hint-text-is-short-and-linked (GOV.UK Design System)."
  },
  {
   "viewpoint": "usability.inline-validation-after-leaving-field"
  },
  {
   "viewpoint": "usability.clearly-marked-emergency-exit"
  },
  {
   "viewpoint": "usability.no-false-affordances"
  },
  {
   "viewpoint": "usability.aesthetic-usability-effect-bias"
  },
  {
   "viewpoint": "usability.postel-tolerant-input"
  },
  {
   "viewpoint": "usability.labels-above-fields"
  },
  {
   "viewpoint": "usability.field-width-matches-expected-input"
  },
  {
   "viewpoint": "usability.start-with-user-needs-design-with-data"
  },
  {
   "viewpoint": "usability.constraints-shift-complexity-to-the-system"
  },
  {
   "viewpoint": "craft.fewer-borders",
   "note": "Same rule, also stated as: canon.gestalt-common-region (Aurora Harley, NN/g); forms.group-related-inputs-in-a-fieldset (U.S. Web Design System (USWDS)); modern.fewer-borders-more-space (Adam Wathan & Steve Schoger); modern.cards-are-a-choice-not-a-default (Stan Kirilov); canon.tufte-one-plus-one-equals-three (Edward Tufte); craft.separation-order-space-then-lines-then-boxes (Adam Wathan & Steve Schoger; Erik D. Kennedy)."
  },
  {
   "viewpoint": "craft.dont-overlook-empty-states-teach-by-example",
   "note": "Same rule, also stated as: modern.every-state-is-designed (Vercel Labs); writing.empty-states-say-what-next (GitHub Primer); data-display.empty-data-explains-and-offers-next-step (IBM Carbon Design System); data-display.wrap-before-truncating-and-reveal-the-rest (GitHub Primer)."
  },
  {
   "viewpoint": "craft.spacing-and-sizing-system",
   "note": "Same rule, also stated as: canon.rams-thorough-to-the-last-detail (Dieter Rams); modern.radii-are-few-and-concentric (Vercel Labs); modern.spacing-comes-from-a-scale (Stan Kirilov)."
  },
  {
   "viewpoint": "craft.align-with-readability-in-mind",
   "note": "Same rule, also stated as: data-display.right-align-numbers-tabular-figures (GitHub Primer); data-display.text-left-headers-follow-their-column (W3C WAI (Eric Eggert, Shadi Abou-Zahra, eds.))."
  },
  {
   "viewpoint": "craft.wcag-contrast-and-dont-rely-on-colour-alone",
   "note": "Same rule, also stated as: modern.contrast-and-not-colour-alone (Apple); color.never-the-only-signal (W3C Accessibility Guidelines Working Group)."
  },
  {
   "viewpoint": "craft.hierarchy-is-everything-squint-test"
  },
  {
   "viewpoint": "craft.greys-dont-have-to-be-grey-never-use-black"
  },
  {
   "viewpoint": "craft.type-scale-few-font-sizes"
  },
  {
   "viewpoint": "canon.rams-understandable",
   "note": "Same rule, also stated as: modern.no-junk-drawer-menus-or-unlabeled-icons (Jakob Nielsen (NN/G)); writing.buttons-name-the-action (IBM Carbon Design System); usability.dont-make-me-think (Steve Krug); craft.labels-are-a-last-resort (Steve Schoger (attendee notes by ynotdraw))."
  },
  {
   "viewpoint": "canon.rams-as-little-design-as-possible"
  },
  {
   "viewpoint": "canon.tufte-smallest-effective-difference"
  },
  {
   "viewpoint": "canon.bringhurst-leading-is-a-rhythmic-unit"
  },
  {
   "viewpoint": "canon.vignelli-syntactic-consistency"
  },
  {
   "viewpoint": "modern.defaults-are-decisions-you-inherited",
   "note": "Same rule, also stated as: craft.supercharge-the-defaults (Steve Schoger (attendee notes by ynotdraw))."
  },
  {
   "viewpoint": "modern.frequent-actions-do-not-animate",
   "note": "Same rule, also stated as: modern.delight-scales-with-rarity (Benji Taylor)."
  },
  {
   "viewpoint": "modern.numbers-and-text-do-not-shift-layout"
  },
  {
   "viewpoint": "modern.motion-values-proportional-to-trigger"
  },
  {
   "viewpoint": "modern.animate-only-transform-and-opacity"
  },
  {
   "viewpoint": "modern.motion-has-an-origin"
  },
  {
   "viewpoint": "modern.honour-prefers-reduced-motion"
  },
  {
   "viewpoint": "modern.animations-are-interruptible"
  },
  {
   "viewpoint": "modern.readable-type-sizes-and-weights"
  },
  {
   "viewpoint": "modern.focus-is-visible-and-unobscured"
  },
  {
   "viewpoint": "modern.shadows-share-one-light-source"
  },
  {
   "viewpoint": "modern.glass-and-blur-earn-their-place"
  },
  {
   "viewpoint": "color.from-tokens-not-hex",
   "note": "Same rule, also stated as: color.mode-aware-tokens-in-every-theme (GitHub Primer)."
  },
  {
   "viewpoint": "color.status-colours-keep-their-meaning"
  },
  {
   "viewpoint": "color.one-action-colour-apart-from-status"
  },
  {
   "viewpoint": "color.controls-and-graphics-3-to-1"
  },
  {
   "viewpoint": "color.focus-ring-contrasts-with-its-surroundings"
  },
  {
   "viewpoint": "color.few-families-in-proportion"
  },
  {
   "viewpoint": "writing.one-label-per-action"
  },
  {
   "viewpoint": "writing.dates-numbers-units-for-the-reader"
  },
  {
   "viewpoint": "data-display.no-tables-for-layout"
  },
  {
   "viewpoint": "data-display.one-unit-and-format-per-column"
  },
  {
   "viewpoint": "data-display.header-cells-are-th-with-scope"
  },
  {
   "viewpoint": "data-display.long-tables-sort-and-say-so"
  },
  {
   "viewpoint": "data-display.summary-list-for-key-value-facts"
  },
  {
   "viewpoint": "forms.error-summary-at-the-top"
  },
  {
   "viewpoint": "forms.validate-when-the-user-is-done"
  },
  {
   "viewpoint": "forms.keep-answers-after-an-error"
  },
  {
   "viewpoint": "forms.mark-optional-fields-in-words"
  },
  {
   "viewpoint": "forms.input-type-matches-the-answer"
  },
  {
   "viewpoint": "forms.ask-only-what-you-need"
  }
 ]
}
