{
 "schema_version": 1,
 "id": "shop",
 "name": "Shop and catalogue",
 "when": "Catalogues, search results and product pages: browse, compare, choose.",
 "picks": [
  {
   "viewpoint": "usability.visibility-of-system-status",
   "note": "Same rule, also stated as: modern.feedback-is-local-and-optimistic (Rauno Freiberg); modern.density-is-value-per-time-and-space (Matthew Ström-Awn); writing.success-names-what-happened (Shopify Polaris); data-display.loading-skeleton-holds-the-layout (GitHub Primer); forms.do-not-disable-the-submit-button (GitHub Primer); feedback.status-messages-announced-without-focus (W3C Accessibility Guidelines Working Group); feedback.confirmation-page-says-what-happens-next (GOV.UK Design System)."
  },
  {
   "viewpoint": "usability.feedback-within-a-second",
   "note": "Same rule, also stated as: modern.interactions-feel-immediate-under-200ms (Rauno Freiberg); feedback.match-the-indicator-to-the-wait (GitHub Primer)."
  },
  {
   "viewpoint": "usability.speak-the-users-language",
   "note": "Same rule, also stated as: writing.errors-say-what-and-how-to-fix (GOV.UK Design System (Government Digital Service)); writing.plain-language-reading-level (Shopify Polaris); forms.error-message-says-how-to-fix (GOV.UK Design System); modern.quality-is-a-choice-spec-is-the-floor (Karri Saarinen); navigation.top-level-is-sections-not-a-site-map (GOV.UK Design System)."
  },
  {
   "viewpoint": "usability.signifiers-make-clickable-look-clickable",
   "note": "Same rule, also stated as: usability.banner-blindness-dont-style-content-like-ads (Kara Pernice, NN/g); craft.button-hierarchy-one-primary (Steve Schoger); canon.gestalt-similarity (Aurora Harley, NN/g); color.one-action-colour-apart-from-status (IBM Carbon Design System)."
  },
  {
   "viewpoint": "usability.fitts-target-size-and-distance",
   "note": "Same rule, also stated as: craft.tap-targets-and-control-height (Erik D. Kennedy); craft.growth-design-psychology-principles (Growth.Design (Dan Benoni, Louis-Xavier Lavallée)); modern.hit-targets-meet-platform-minimums (Apple)."
  },
  {
   "viewpoint": "usability.von-restorff-one-emphasis",
   "note": "Same rule, also stated as: canon.vignelli-weight-for-function-not-volume (Massimo Vignelli)."
  },
  {
   "viewpoint": "usability.hicks-fewer-choices-when-time-matters"
  },
  {
   "viewpoint": "usability.mindless-clicks-not-fewer-clicks",
   "note": "Same rule, also stated as: writing.links-describe-their-destination (Mailchimp)."
  },
  {
   "viewpoint": "usability.no-false-affordances",
   "note": "Same rule, also stated as: modern.no-dead-zones-and-honest-clickability (Rauno Freiberg)."
  },
  {
   "viewpoint": "usability.follow-conventions",
   "note": "Same rule, also stated as: craft.anything-but-dropdowns (Erik D. Kennedy); modern.boring-and-familiar-beats-novel (Scott Berkun)."
  },
  {
   "viewpoint": "usability.visual-hierarchy-for-scanning",
   "note": "Same rule, also stated as: craft.hierarchy-is-everything-squint-test (Erik D. Kennedy)."
  },
  {
   "viewpoint": "usability.clearly-marked-emergency-exit",
   "note": "Same rule, also stated as: feedback.toast-actions-wait-for-the-user (Shopify Polaris)."
  },
  {
   "viewpoint": "usability.aesthetic-usability-effect-bias"
  },
  {
   "viewpoint": "usability.natural-mapping-and-proximity"
  },
  {
   "viewpoint": "usability.start-with-user-needs-design-with-data"
  },
  {
   "viewpoint": "craft.fewer-borders",
   "note": "Same rule, also stated as: canon.gestalt-common-region (Aurora Harley, NN/g); forms.group-related-inputs-in-a-fieldset (U.S. Web Design System (USWDS)); modern.fewer-borders-more-space (Adam Wathan & Steve Schoger); modern.cards-are-a-choice-not-a-default (Stan Kirilov); canon.tufte-one-plus-one-equals-three (Edward Tufte); craft.separation-order-space-then-lines-then-boxes (Adam Wathan & Steve Schoger; Erik D. Kennedy)."
  },
  {
   "viewpoint": "craft.spacing-and-sizing-system",
   "note": "Same rule, also stated as: canon.rams-thorough-to-the-last-detail (Dieter Rams); modern.radii-are-few-and-concentric (Vercel Labs); modern.spacing-comes-from-a-scale (Stan Kirilov)."
  },
  {
   "viewpoint": "craft.wcag-contrast-and-dont-rely-on-colour-alone",
   "note": "Same rule, also stated as: modern.contrast-and-not-colour-alone (Apple); color.never-the-only-signal (W3C Accessibility Guidelines Working Group); navigation.you-are-here (U.S. Web Design System (USWDS)); feedback.message-type-said-in-words (U.S. Web Design System)."
  },
  {
   "viewpoint": "craft.de-emphasize-to-emphasize-up-pop-down-pop",
   "note": "Same rule, also stated as: canon.tufte-smallest-effective-difference (Edward Tufte)."
  },
  {
   "viewpoint": "craft.black-and-white-first-limit-hues",
   "note": "Same rule, also stated as: color.few-families-in-proportion (U.S. Web Design System (GSA))."
  },
  {
   "viewpoint": "craft.greys-dont-have-to-be-grey-never-use-black"
  },
  {
   "viewpoint": "craft.start-with-too-much-whitespace"
  },
  {
   "viewpoint": "craft.type-scale-few-font-sizes"
  },
  {
   "viewpoint": "canon.rams-as-little-design-as-possible"
  },
  {
   "viewpoint": "canon.bringhurst-leading-is-a-rhythmic-unit"
  },
  {
   "viewpoint": "canon.vignelli-grid-module-fits-the-job"
  },
  {
   "viewpoint": "canon.bringhurst-letterspace-caps-5-10"
  },
  {
   "viewpoint": "modern.every-state-is-designed",
   "note": "Same rule, also stated as: writing.empty-states-say-what-next (GitHub Primer); data-display.empty-data-explains-and-offers-next-step (IBM Carbon Design System); data-display.wrap-before-truncating-and-reveal-the-rest (GitHub Primer)."
  },
  {
   "viewpoint": "modern.no-junk-drawer-menus-or-unlabeled-icons",
   "note": "Same rule, also stated as: writing.buttons-name-the-action (IBM Carbon Design System); navigation.primary-nav-visible-on-wide-screens (GitHub Primer); usability.dont-make-me-think (Steve Krug)."
  },
  {
   "viewpoint": "modern.frequent-actions-do-not-animate",
   "note": "Same rule, also stated as: modern.motion-values-proportional-to-trigger (Rauno Freiberg); feedback.motion-duration-scales-with-size (IBM Carbon Design System)."
  },
  {
   "viewpoint": "modern.honour-prefers-reduced-motion",
   "note": "Same rule, also stated as: feedback.moving-content-can-be-paused (W3C Accessibility Guidelines Working Group)."
  },
  {
   "viewpoint": "modern.signifiers-survive-flatness"
  },
  {
   "viewpoint": "modern.mobile-inputs-do-not-zoom-or-trap",
   "note": "Same rule, also stated as: forms.input-type-matches-the-answer (GOV.UK Design System)."
  },
  {
   "viewpoint": "modern.numbers-and-text-do-not-shift-layout",
   "note": "Same rule, also stated as: data-display.right-align-numbers-tabular-figures (GitHub Primer)."
  },
  {
   "viewpoint": "modern.delight-scales-with-rarity"
  },
  {
   "viewpoint": "modern.animate-only-transform-and-opacity"
  },
  {
   "viewpoint": "modern.motion-has-an-origin"
  },
  {
   "viewpoint": "modern.animations-are-interruptible"
  },
  {
   "viewpoint": "modern.readable-type-sizes-and-weights"
  },
  {
   "viewpoint": "modern.focus-is-visible-and-unobscured"
  },
  {
   "viewpoint": "modern.shadows-share-one-light-source"
  },
  {
   "viewpoint": "modern.defaults-are-decisions-you-inherited"
  },
  {
   "viewpoint": "color.status-colours-keep-their-meaning"
  },
  {
   "viewpoint": "color.from-tokens-not-hex"
  },
  {
   "viewpoint": "color.controls-and-graphics-3-to-1"
  },
  {
   "viewpoint": "color.focus-ring-contrasts-with-its-surroundings"
  },
  {
   "viewpoint": "writing.one-label-per-action",
   "note": "Same rule, also stated as: navigation.same-navigation-on-every-page (W3C WAI)."
  },
  {
   "viewpoint": "writing.sentence-case-ui-text"
  },
  {
   "viewpoint": "writing.dates-numbers-units-for-the-reader"
  },
  {
   "viewpoint": "data-display.no-tables-for-layout"
  },
  {
   "viewpoint": "data-display.text-left-headers-follow-their-column"
  },
  {
   "viewpoint": "data-display.one-unit-and-format-per-column"
  },
  {
   "viewpoint": "data-display.summary-list-for-key-value-facts"
  },
  {
   "viewpoint": "forms.error-summary-at-the-top"
  },
  {
   "viewpoint": "forms.validate-when-the-user-is-done"
  },
  {
   "viewpoint": "forms.keep-answers-after-an-error"
  },
  {
   "viewpoint": "forms.mark-optional-fields-in-words"
  },
  {
   "viewpoint": "forms.autocomplete-names-the-purpose"
  },
  {
   "viewpoint": "forms.hint-text-is-short-and-linked"
  },
  {
   "viewpoint": "forms.ask-only-what-you-need"
  },
  {
   "viewpoint": "navigation.breadcrumbs-only-for-real-hierarchy"
  },
  {
   "viewpoint": "navigation.skip-link-is-the-first-tab-stop"
  },
  {
   "viewpoint": "navigation.more-than-one-way-to-a-page"
  },
  {
   "viewpoint": "navigation.pagination-says-where-and-how-many"
  },
  {
   "viewpoint": "feedback.toasts-carry-nothing-critical"
  }
 ]
}
