{
 "schema_version": 1,
 "id": "shop",
 "name": "Shop and catalogue",
 "when": "Catalogues, search results and product pages: browse, compare, choose.",
 "picks": [
  {
   "viewpoint": "usability.signifiers-make-clickable-look-clickable",
   "note": "Same rule, also stated as: modern.signifiers-survive-flatness (Kate Moran (NN/G)); canon.gestalt-similarity (Aurora Harley, NN/g); modern.no-dead-zones-and-honest-clickability (Rauno Freiberg)."
  },
  {
   "viewpoint": "usability.fitts-target-size-and-distance",
   "note": "Same rule, also stated as: craft.tap-targets-and-control-height (Erik D. Kennedy); craft.growth-design-psychology-principles (Growth.Design (Dan Benoni, Louis-Xavier Lavallée)); modern.hit-targets-meet-platform-minimums (Apple)."
  },
  {
   "viewpoint": "usability.von-restorff-one-emphasis",
   "note": "Same rule, also stated as: craft.button-hierarchy-one-primary (Steve Schoger); canon.vignelli-weight-for-function-not-volume (Massimo Vignelli)."
  },
  {
   "viewpoint": "usability.feedback-within-a-second",
   "note": "Same rule, also stated as: modern.interactions-feel-immediate-under-200ms (Rauno Freiberg); modern.density-is-value-per-time-and-space (Matthew Ström-Awn)."
  },
  {
   "viewpoint": "usability.visibility-of-system-status",
   "note": "Same rule, also stated as: modern.feedback-is-local-and-optimistic (Rauno Freiberg)."
  },
  {
   "viewpoint": "usability.follow-conventions",
   "note": "Same rule, also stated as: craft.anything-but-dropdowns (Erik D. Kennedy); modern.boring-and-familiar-beats-novel (Scott Berkun)."
  },
  {
   "viewpoint": "usability.visual-hierarchy-for-scanning",
   "note": "Same rule, also stated as: craft.hierarchy-is-everything-squint-test (Erik D. Kennedy)."
  },
  {
   "viewpoint": "usability.hicks-fewer-choices-when-time-matters"
  },
  {
   "viewpoint": "usability.banner-blindness-dont-style-content-like-ads"
  },
  {
   "viewpoint": "usability.speak-the-users-language"
  },
  {
   "viewpoint": "usability.no-false-affordances"
  },
  {
   "viewpoint": "usability.aesthetic-usability-effect-bias"
  },
  {
   "viewpoint": "usability.clearly-marked-emergency-exit"
  },
  {
   "viewpoint": "usability.natural-mapping-and-proximity"
  },
  {
   "viewpoint": "usability.mindless-clicks-not-fewer-clicks"
  },
  {
   "viewpoint": "usability.start-with-user-needs-design-with-data"
  },
  {
   "viewpoint": "craft.fewer-borders",
   "note": "Same rule, also stated as: canon.gestalt-common-region (Aurora Harley, NN/g); canon.rams-as-little-design-as-possible (Dieter Rams); modern.fewer-borders-more-space (Adam Wathan & Steve Schoger); canon.tufte-smallest-effective-difference (Edward Tufte); canon.tufte-one-plus-one-equals-three (Edward Tufte)."
  },
  {
   "viewpoint": "craft.spacing-and-sizing-system",
   "note": "Same rule, also stated as: canon.rams-thorough-to-the-last-detail (Dieter Rams); modern.radii-are-few-and-concentric (Vercel Labs); modern.quality-is-a-choice-spec-is-the-floor (Karri Saarinen); modern.spacing-comes-from-a-scale (Stan Kirilov)."
  },
  {
   "viewpoint": "craft.separation-order-space-then-lines-then-boxes"
  },
  {
   "viewpoint": "craft.de-emphasize-to-emphasize-up-pop-down-pop"
  },
  {
   "viewpoint": "craft.wcag-contrast-and-dont-rely-on-colour-alone",
   "note": "Same rule, also stated as: modern.contrast-and-not-colour-alone (Apple)."
  },
  {
   "viewpoint": "craft.greys-dont-have-to-be-grey-never-use-black"
  },
  {
   "viewpoint": "craft.start-with-too-much-whitespace"
  },
  {
   "viewpoint": "craft.type-scale-few-font-sizes"
  },
  {
   "viewpoint": "craft.black-and-white-first-limit-hues"
  },
  {
   "viewpoint": "canon.bringhurst-leading-is-a-rhythmic-unit"
  },
  {
   "viewpoint": "canon.vignelli-grid-module-fits-the-job"
  },
  {
   "viewpoint": "canon.bringhurst-letterspace-caps-5-10"
  },
  {
   "viewpoint": "modern.cards-are-a-choice-not-a-default"
  },
  {
   "viewpoint": "modern.frequent-actions-do-not-animate",
   "note": "Same rule, also stated as: modern.delight-scales-with-rarity (Benji Taylor)."
  },
  {
   "viewpoint": "modern.no-junk-drawer-menus-or-unlabeled-icons",
   "note": "Same rule, also stated as: usability.dont-make-me-think (Steve Krug)."
  },
  {
   "viewpoint": "modern.motion-values-proportional-to-trigger"
  },
  {
   "viewpoint": "modern.animate-only-transform-and-opacity"
  },
  {
   "viewpoint": "modern.motion-has-an-origin"
  },
  {
   "viewpoint": "modern.honour-prefers-reduced-motion"
  },
  {
   "viewpoint": "modern.animations-are-interruptible"
  },
  {
   "viewpoint": "modern.readable-type-sizes-and-weights"
  },
  {
   "viewpoint": "modern.mobile-inputs-do-not-zoom-or-trap"
  },
  {
   "viewpoint": "modern.focus-is-visible-and-unobscured"
  },
  {
   "viewpoint": "modern.every-state-is-designed"
  },
  {
   "viewpoint": "modern.numbers-and-text-do-not-shift-layout"
  },
  {
   "viewpoint": "modern.shadows-share-one-light-source"
  },
  {
   "viewpoint": "modern.defaults-are-decisions-you-inherited"
  }
 ]
}
