{
 "schema_version": 1,
 "id": "transaction",
 "name": "Transactions and forms",
 "when": "Checkout, sign-up, booking, onboarding and multi-step forms: one task, completed once, correctly.",
 "picks": [
  {
   "viewpoint": "usability.visibility-of-system-status",
   "note": "Same rule, also stated as: modern.feedback-is-local-and-optimistic (Rauno Freiberg); writing.success-names-what-happened (Shopify Polaris); forms.do-not-disable-the-submit-button (GitHub Primer); feedback.status-messages-announced-without-focus (W3C Accessibility Guidelines Working Group); feedback.confirmation-page-says-what-happens-next (GOV.UK Design System)."
  },
  {
   "viewpoint": "usability.fitts-target-size-and-distance",
   "note": "Same rule, also stated as: usability.hicks-fewer-choices-when-time-matters (Jon Yablonski (Laws of UX)); usability.peak-end-finish-well (Jon Yablonski (Laws of UX)); usability.von-restorff-one-emphasis (GOV.UK Design System); craft.growth-design-psychology-principles (Growth.Design (Dan Benoni, Louis-Xavier Lavallée)); modern.no-deceptive-patterns (Harry Brignull)."
  },
  {
   "viewpoint": "usability.speak-the-users-language",
   "note": "Same rule, also stated as: writing.errors-say-what-and-how-to-fix (GOV.UK Design System (Government Digital Service)); writing.plain-language-reading-level (Shopify Polaris); forms.error-message-says-how-to-fix (GOV.UK Design System); modern.quality-is-a-choice-spec-is-the-floor (Karri Saarinen)."
  },
  {
   "viewpoint": "usability.feedback-within-a-second",
   "note": "Same rule, also stated as: modern.interactions-feel-immediate-under-200ms (Rauno Freiberg); feedback.match-the-indicator-to-the-wait (GitHub Primer)."
  },
  {
   "viewpoint": "usability.postel-tolerant-input",
   "note": "Same rule, also stated as: craft.body-16px-line-height-1-5 (Steve Schoger); modern.mobile-inputs-do-not-zoom-or-trap (Rauno Freiberg); forms.input-type-matches-the-answer (GOV.UK Design System)."
  },
  {
   "viewpoint": "usability.clearly-marked-emergency-exit",
   "note": "Same rule, also stated as: forms.keep-answers-after-an-error (GOV.UK Design System); navigation.back-link-goes-one-step-back (GOV.UK Design System); navigation.breadcrumbs-only-for-real-hierarchy (GOV.UK Design System)."
  },
  {
   "viewpoint": "usability.omit-needless-words",
   "note": "Same rule, also stated as: writing.sentence-case-ui-text (IBM Carbon Design System)."
  },
  {
   "viewpoint": "usability.fewer-checkout-fields",
   "note": "Same rule, also stated as: forms.mark-optional-fields-in-words (GOV.UK Design System); forms.ask-only-what-you-need (GOV.UK Design System)."
  },
  {
   "viewpoint": "usability.minimalist-no-competing-information"
  },
  {
   "viewpoint": "usability.no-false-affordances",
   "note": "Same rule, also stated as: canon.rams-honest (Dieter Rams)."
  },
  {
   "viewpoint": "usability.help-in-context",
   "note": "Same rule, also stated as: usability.placeholders-are-not-labels (Katie Sherwin, NN/g); forms.hint-text-is-short-and-linked (GOV.UK Design System)."
  },
  {
   "viewpoint": "usability.signifiers-make-clickable-look-clickable",
   "note": "Same rule, also stated as: modern.signifiers-survive-flatness (Kate Moran (NN/G))."
  },
  {
   "viewpoint": "usability.inline-validation-after-leaving-field"
  },
  {
   "viewpoint": "usability.progress-indication-in-flows"
  },
  {
   "viewpoint": "usability.single-column-forms"
  },
  {
   "viewpoint": "usability.aesthetic-usability-effect-bias"
  },
  {
   "viewpoint": "usability.natural-mapping-and-proximity"
  },
  {
   "viewpoint": "usability.labels-above-fields"
  },
  {
   "viewpoint": "usability.field-width-matches-expected-input"
  },
  {
   "viewpoint": "usability.one-thing-per-page"
  },
  {
   "viewpoint": "usability.dont-make-me-think"
  },
  {
   "viewpoint": "usability.start-with-user-needs-design-with-data"
  },
  {
   "viewpoint": "usability.constraints-shift-complexity-to-the-system"
  },
  {
   "viewpoint": "craft.fewer-borders",
   "note": "Same rule, also stated as: canon.gestalt-common-region (Aurora Harley, NN/g); canon.rams-as-little-design-as-possible (Dieter Rams); modern.fewer-borders-more-space (Adam Wathan & Steve Schoger); canon.tufte-smallest-effective-difference (Edward Tufte); canon.tufte-one-plus-one-equals-three (Edward Tufte)."
  },
  {
   "viewpoint": "craft.spacing-and-sizing-system",
   "note": "Same rule, also stated as: canon.rams-thorough-to-the-last-detail (Dieter Rams); modern.radii-are-few-and-concentric (Vercel Labs); modern.spacing-comes-from-a-scale (Stan Kirilov)."
  },
  {
   "viewpoint": "craft.wcag-contrast-and-dont-rely-on-colour-alone",
   "note": "Same rule, also stated as: modern.contrast-and-not-colour-alone (Apple); color.never-the-only-signal (W3C Accessibility Guidelines Working Group); feedback.message-type-said-in-words (U.S. Web Design System)."
  },
  {
   "viewpoint": "craft.separation-order-space-then-lines-then-boxes"
  },
  {
   "viewpoint": "craft.button-hierarchy-one-primary",
   "note": "Same rule, also stated as: writing.destructive-actions-name-the-consequence (IBM Carbon Design System)."
  },
  {
   "viewpoint": "craft.anything-but-dropdowns",
   "note": "Same rule, also stated as: modern.boring-and-familiar-beats-novel (Scott Berkun); forms.memorable-dates-as-three-fields (GOV.UK Design System)."
  },
  {
   "viewpoint": "craft.tap-targets-and-control-height",
   "note": "Same rule, also stated as: modern.hit-targets-meet-platform-minimums (Apple)."
  },
  {
   "viewpoint": "craft.type-scale-few-font-sizes",
   "note": "Same rule, also stated as: canon.vignelli-two-type-sizes (Massimo Vignelli)."
  },
  {
   "viewpoint": "craft.hierarchy-is-everything-squint-test"
  },
  {
   "viewpoint": "craft.greys-dont-have-to-be-grey-never-use-black"
  },
  {
   "viewpoint": "craft.grids-are-overrated-content-dictates-width"
  },
  {
   "viewpoint": "canon.bringhurst-leading-is-a-rhythmic-unit"
  },
  {
   "viewpoint": "canon.butterick-emphasis-sparingly"
  },
  {
   "viewpoint": "modern.motion-values-proportional-to-trigger",
   "note": "Same rule, also stated as: feedback.motion-duration-scales-with-size (IBM Carbon Design System)."
  },
  {
   "viewpoint": "modern.defaults-are-decisions-you-inherited",
   "note": "Same rule, also stated as: craft.supercharge-the-defaults (Steve Schoger (attendee notes by ynotdraw))."
  },
  {
   "viewpoint": "modern.readable-type-sizes-and-weights"
  },
  {
   "viewpoint": "modern.every-state-is-designed"
  },
  {
   "viewpoint": "modern.numbers-and-text-do-not-shift-layout",
   "note": "Same rule, also stated as: data-display.right-align-numbers-tabular-figures (GitHub Primer)."
  },
  {
   "viewpoint": "modern.delight-scales-with-rarity"
  },
  {
   "viewpoint": "modern.animate-only-transform-and-opacity"
  },
  {
   "viewpoint": "modern.focus-is-visible-and-unobscured"
  },
  {
   "viewpoint": "color.status-colours-keep-their-meaning"
  },
  {
   "viewpoint": "color.from-tokens-not-hex"
  },
  {
   "viewpoint": "color.one-action-colour-apart-from-status"
  },
  {
   "viewpoint": "color.controls-and-graphics-3-to-1"
  },
  {
   "viewpoint": "color.focus-ring-contrasts-with-its-surroundings"
  },
  {
   "viewpoint": "color.few-families-in-proportion"
  },
  {
   "viewpoint": "writing.buttons-name-the-action"
  },
  {
   "viewpoint": "writing.one-label-per-action"
  },
  {
   "viewpoint": "writing.dates-numbers-units-for-the-reader"
  },
  {
   "viewpoint": "data-display.text-left-headers-follow-their-column"
  },
  {
   "viewpoint": "data-display.no-tables-for-layout"
  },
  {
   "viewpoint": "data-display.summary-list-for-key-value-facts"
  },
  {
   "viewpoint": "forms.error-summary-at-the-top"
  },
  {
   "viewpoint": "forms.group-related-inputs-in-a-fieldset"
  },
  {
   "viewpoint": "forms.validate-when-the-user-is-done"
  },
  {
   "viewpoint": "forms.autocomplete-names-the-purpose"
  },
  {
   "viewpoint": "navigation.skip-link-is-the-first-tab-stop"
  },
  {
   "viewpoint": "feedback.time-limits-warn-and-extend"
  },
  {
   "viewpoint": "feedback.toasts-carry-nothing-critical"
  }
 ]
}
